{
  "id": "04-structured-blazer",
  "name": "black tailored blazer",
  "category": "outerwear",
  "color": "black",
  "pattern": "solid",
  "fabric": "matte suiting wool, structured with soft shoulder padding",
  "fit": "slightly oversized boxy tailored fit, straight through the body, hits at the hip",
  "layer_order": 1,
  "difficulty": 3,
  "size_owned": "S",
  "details_to_preserve": [
    "notch lapels, medium width",
    "single-breasted 2-button front with round black buttons",
    "welt chest pocket on the left, jetted hip pockets",
    "clean structured shoulder line, slightly extended",
    "sleeves full length, hitting past the wrist"
  ],
  "source_photo_type": "on-model",
  "notes": "worn open over a white tee in the photo - tee, belt, and trousers NOT part of this garment; renders should layer it open over the outfit's top"
}
